index	タイトル	2023-02-18	2023-02-19	2023-02-20	2023-02-21
https://youtu.be/15qSw_5lDcA	佐藤優樹『Ding Dong』 	97219	222810	290024	339573
https://youtu.be/JFl_KJylamQ	 Teenage Solution 佐藤優樹 x 北川莉央	202643	205428	207439	209677
https://youtu.be/9rtacNv5qjk	 Do it! Now 佐藤優樹 x 加賀楓	327319	329418	331089	332534
https://youtu.be/YgDxP3kHmJs	 サマーナイトタウン / 田中れいな x 佐藤優樹	1161093	1164450	1167395	1170035
https://youtu.be/Bn14XigbuyI	 ほたる祭りの日 佐藤優樹 x 宮本佳林 (ジュリン)	229520	229801	230010	230228
https://youtu.be/pIIrJUIc85s	 糸島Distance 佐藤優樹 x 平山遊季	552925	553648	554672	555455
https://youtu.be/2CRdMwHZxIQ	 寒いね。(2020 Ver.) 佐藤優樹 x 金澤朋子	560286	560847	561282	561667
